{
  "eventId": "11111111-1111-1111-1111-111111111111",
  "tenantId": "22222222-2222-2222-2222-222222222222",
  "eventType": "audit_record.created",
  "eventVersion": 1,
  "occurredAt": "2026-06-06T00:00:00Z",
  "producer": { "service": "audit-replay-service", "version": "0.1.0" },
  "aggregate": { "type": "audit-record", "id": "audit-1", "version": 1 },
  "actor": { "type": "SERVICE", "id": "audit-replay-service" },
  "correlationId": "33333333-3333-3333-3333-333333333333",
  "causationId": null,
  "idempotencyKey": "idem-audit-1",
  "schemaRef": "audit-record-created-v1",
  "payload": { "id": "audit-1", "tenantId": "22222222-2222-2222-2222-222222222222", "status": "CREATED", "version": 1, "summary": "audit evidence captured", "sourceRefs": ["audit:1"] },
  "payloadHash": "fixture-payload-hash-computed-by-service-tests",
  "previousHash": null,
  "integrityHash": "fixture-integrity-hash-computed-by-service-tests",
  "legalHoldTags": []
}
