{
  "eventId": "44444444-4444-4444-4444-444444444444",
  "tenantId": "55555555-5555-5555-5555-555555555555",
  "eventType": "audit_record.created",
  "eventVersion": 1,
  "occurredAt": "2026-06-06T00:00:01Z",
  "producer": { "service": "audit-replay-service", "version": "0.1.0" },
  "aggregate": { "type": "audit-record", "id": "audit-2", "version": 1 },
  "actor": { "type": "SERVICE", "id": "audit-replay-service" },
  "correlationId": "66666666-6666-6666-6666-666666666666",
  "causationId": "77777777-7777-7777-7777-777777777777",
  "idempotencyKey": "idem-audit-2",
  "schemaRef": "audit-record-created-v1",
  "payload": {
    "id": "44444444-4444-4444-4444-444444444444",
    "tenantId": "55555555-5555-5555-5555-555555555555",
    "status": "CREATED",
    "version": 1,
    "summary": "QUOTE_CREATED quote:123",
    "sourceRefs": ["quote:123"],
    "auditRecordId": "44444444-4444-4444-4444-444444444444",
    "subject": { "type": "quote", "id": "123" },
    "action": "QUOTE_CREATED",
    "actor": { "type": "SERVICE", "id": "audit-replay-service" },
    "result": "SUCCESS",
    "occurredAt": "2026-06-06T00:00:01Z",
    "integrityHash": "fixture-integrity-hash-computed-by-service-tests",
    "retentionUntil": "2033-06-06",
    "legalHold": false
  },
  "payloadHash": "fixture-payload-hash-computed-by-service-tests",
  "previousHash": null,
  "integrityHash": "fixture-integrity-hash-computed-by-service-tests",
  "legalHoldTags": ["legal-hold-config-ref"]
}
